"author"	"affiliation"	"affiliation_fix"
"Semih Cakir"	"Université de Montréal, Canada. University of Vienna, Austria"	"Université de Montréal, Canada. University of Vienna, Austria"
"Sigrid Roßteutscher"	"Goethe University Frankfurt/Main, Germany. Goethe University Frankfurt am Main, Germany"	"Goethe University Frankfurt/Main, Germany. Goethe University Frankfurt am Main, Germany"
"Silvia Decadri"	"Università degli Studi di Milano (UNIMI), Italy. Università degli Studi di Milano, Italy"	"Università degli Studi di Milano (UNIMI), Italy. Università degli Studi di Milano, Italy"
"Silvia Pianta"	"RFF - CMCC European Institute on Economics and the Environment, Italy. RFF-CMCC European Institute on Economics and the Environment & European University Institute, Italy"	"RFF - CMCC European Institute on Economics and the Environment, Italy. RFF-CMCC European Institute on Economics and the Environment & European University Institute, Italy"
"Simon Hug"	"Universit of Geneva, Switzerland. University of Geneva, Switzerland"	"Universit of Geneva, Switzerland. University of Geneva, Switzerland"
"Simon T. Franzmann"	"Department for Democracy Research, University of Goettingen, Germany. University of Goettingen, Germany"	"Department for Democracy Research, University of Goettingen, Germany. University of Goettingen, Germany"
"Sirianne Dahlum"	"University of Oslo, Norway. Oslo, Norway"	"University of Oslo, Norway. Oslo, Norway"
"Sirus Dehdari"	"Stockholm University, Sweden. Stockholm University,, Sweden"	"Stockholm University, Sweden. Stockholm University,, Sweden"
"Sivaram Cheruvu"	"University of Texas-Dallas, USA. University of Texas at Dallas, USA"	"University of Texas-Dallas, USA. University of Texas at Dallas, USA"
"Sofia Vasilopoulou"	"King's College London, United Kingdom. King’s College London, United Kingdom"	"King's College London, United Kingdom. King’s College London, United Kingdom"
"Sona Golder"	"Penn State University, USA. Pennsylvania State University, USA"	"Penn State University, USA. Pennsylvania State University, USA"
"Stefan Müller"	"University College Dublin, Ireland. University College, Dublin, Ireland"	"University College Dublin, Ireland. University College, Dublin, Ireland"
"Stefanie Bailer"	"University of Basel, Switzerland. University of Basel, Germany"	"University of Basel, Switzerland. University of Basel, Germany"
"Sven Hegewald"	"ETH Zurich, Switzerland. ETH, Switzerland"	"ETH Zurich, Switzerland. ETH, Switzerland"
"Sven-Oliver Proksch"	"University of Cologne, Germany. University of Cologne, Cologne Center for Comparative Politics, Germany"	"University of Cologne, Germany. University of Cologne, Cologne Center for Comparative Politics, Germany"
"Tana Johnson"	"University of Wisconsin-Madison, USA. University of Wisconsin, USA"	"University of Wisconsin-Madison, USA. University of Wisconsin, USA"
"Tarik Abou-Chadi"	"University of Oxford, United Kingdom. Oxford University, United Kingdom"	"University of Oxford, United Kingdom. Oxford University, United Kingdom"
"Theres Matthieß"	"University of Trier, Germany. University of Trier, Netherlands"	"University of Trier, Germany. University of Trier, Netherlands"
"Theresa Gessler"	"European University Viadrina, Germany. Europa Universität Viadrina, Germany"	"European University Viadrina, Germany. Europa Universität Viadrina, Germany"
"Theresa Squatrito"	"London School of Economics and Political Science, United Kingdom. London School of Economics, United Kingdom"	"London School of Economics and Political Science, United Kingdom. London School of Economics, United Kingdom"
"Thomas Bernauer"	"ETH Zurich, Switzerland. ETH-Zurich, Switzerland. ETH Zürich, Switzerland"	"ETH Zurich, Switzerland. ETH-Zurich, Switzerland. ETH Zürich, Switzerland"
"Thomas Hale"	"University of Oxford, United Kingdom. Oxford University, United Kingdom"	"University of Oxford, United Kingdom. Oxford University, United Kingdom"
"Thomas Robinson"	"London School of Economics, United Kingdom. LSE, United Kingdom"	"London School of Economics, United Kingdom. LSE, United Kingdom"
"Thomas Tichelbaecker"	"princeton university, USA. Princeton University, USA"	"princeton university, USA. Princeton University, USA"
"Tolga Sinmazdemir"	"SOAS, United Kingdom. School of Oriental and African Studies SOAS, United Kingdom"	"SOAS, United Kingdom. School of Oriental and African Studies SOAS, United Kingdom"
"Toni Rodon"	"Universitat Pompeu Fabra, Spain. Pompeu Fabra University, Spain"	"Universitat Pompeu Fabra, Spain. Pompeu Fabra University, Spain"
"Valentina Consiglio"	"University of Zurich, Switzerland. University of Konstanz, Germany"	"University of Zurich, Switzerland. University of Konstanz, Germany"
"Valerio Vignoli"	"University of Milan, Italy. Università degli Studi Milano, Italy"	"University of Milan, Italy. Università degli Studi Milano, Italy"
"Vally Koubi"	"ETH Zurich, Switzerland. ETH Zürich, Switzerland"	"ETH Zurich, Switzerland. ETH Zürich, Switzerland"
"Vered Porzycki"	"The Hebrew University of Jerusalem, Israel. The Hebrew University of jerusalem, Israel"	"The Hebrew University of Jerusalem, Israel. The Hebrew University of jerusalem, Israel"
"Verena Reidinger"	"University of Zurich, Switzerland. Department of Political Science, University of Zurich, Switzerland"	"University of Zurich, Switzerland. Department of Political Science, University of Zurich, Switzerland"
"Vicente Valentim"	"Nuffield College, University of Oxford, United Kingdom. University of Oxford, United Kingdom. University of Oxford (Nuffield College), United Kingdom"	"Nuffield College, University of Oxford, United Kingdom. University of Oxford, United Kingdom. University of Oxford (Nuffield College), United Kingdom"
"Volha Charnysh"	"Massachusetts Institute of Technology, USA. MIT, USA"	"Massachusetts Institute of Technology, USA. MIT, USA"
"Zachary Dickson"	"London School of Economics, United Kingdom. London School of Economics and Political Science, United Kingdom"	"London School of Economics, United Kingdom. London School of Economics and Political Science, United Kingdom"
"Øyvind Skorge"	"Oslo New University College, Norway. Oslo New University College,, Norway"	"Oslo New University College, Norway. Oslo New University College,, Norway"